{
  "formatVersion": 1,
  "createdAt": "2026-09-11T09:00:00.000Z",
  "vaultId": "018f2c1e-6d5b-7c3a-9f2e-7c4d5e6f7081",
  "entries": [
    {
      "name": "transactions.csv",
      "bytes": 248,
      "sha256": "1c0a1f5c3f7a9b2d4e6f8a0b1c2d3e4f5a6b7c8d9e0f1a2b3c4d5e6f7a8b9c0d"
    },
    {
      "name": "tagging_rules.json",
      "bytes": 412,
      "sha256": "2d1b2a6d4a8b3c5e7f9a1b2c3d4e5f6a7b8c9d0e1f2a3b4c5d6e7f8a9b0c1d2e"
    }
  ]
}
